{
  "schema_version": "1.0",
  "request_id": "req-advisor-demo",
  "generated_at": "2026-07-27T09:40:00Z",
  "interpreted_study_mode": "quiet",
  "interpreted_needs": ["quiet", "bright"],
  "applied_preferences": {
    "quiet_priority": 0.9,
    "low_occupancy_priority": 0.7,
    "brightness_priority": 0.9,
    "comfort_priority": 0.4,
    "distance_priority": 0.2
  },
  "focus_room_id": "room_a",
  "advisor_message": "Quiet study conditions and calibrated light support focused revision.",
  "advice_source": "llm",
  "recommendations": [
    {
      "room_id": "room_a",
      "rank": 1,
      "score": 86,
      "current_state": "quiet_study_recommended",
      "occupancy_level": "low",
      "forecast_30m": "low",
      "confidence": 0.88,
      "is_stale": false,
      "reasons": [
        "Current conditions suit quiet study.",
        "Calibrated light is close to the study target."
      ],
      "explanation": "Quiet study conditions and calibrated light support focused revision.",
      "explanation_source": "llm"
    }
  ],
  "warnings": ["STUDY_GOAL_NOT_STORED"]
}
